{
  "$schema": "../../engine/pack_loader/pack.schema.json",
  "id": "firebase-release",
  "ruleRoutingGuidance": {
    "belongs": "dev/prod Firebase project split, committed-default-dev discipline, pipeline-injected prod config, App Check attestation gating, promotion cadence",
    "excludes": "everyday Firestore rules, function patterns and deploy layout — firebase; app store submission — play-store-release, app-store-release"
  },
  "badge": "badge.svg",
  "marker": null,
  "detect": null,
  "prose": "RULES.md",
  "requires": ["firebase"]
}
