{
  "$schema": "../../../../engine/pack_loader/pack.schema.json",
  "id": "claudinite",
  "ruleRoutingGuidance": {
    "belongs": "working rules and lessons specific to developing Claudinite itself and not portable to any consumer",
    "excludes": "fleet-facing curation duties and policing of the packs/ tree — that is the canon-curation local pack"
  },
  "badge": "badge.svg",
  "prose": "RULES.md",
  "worldRules": ["home-seeded-packs-declared.mjs"]
}
